{
"$schema": "https://json-schema.org/draft/2020-12/schema",
"$id": "https://kristal.org/schemas/v5/exchange-federation-manifest.schema.json",
"title": "Kristal v5 Exchange Federation Manifest",
"type": "object",
"additionalProperties": false,
"required": [
"schema_version",
"artifact_type",
"created_at",
"federation_id",
"canonicalization_profile",
"canonicalization_version",
"content_hash",
"authority_registry_ref",
"shards",
"composition_policy",
"reader_policy_refs",
"authority_recognition_refs",
"validation_policy_refs",
"publisher",
"signatures"
],
"properties": {
"schema_version": {
"type": "string",
"const": "5.0",
"description": "Manifest schema version."
},
"artifact_type": {
"type": "string",
"const": "exchange_federation_manifest",
"description": "Artifact discriminator."
},
"manifest_id": {
"type": "string",
"minLength": 1,
"description": "Optional non-content-addressed operational identifier for this manifest."
},
"created_at": {
"type": "string",
"format": "date-time",
"description": "UTC timestamp when the manifest was produced. It is not part of the federation hash target."
},
"federation_id": {
"$ref": "#/$defs/federation_id",
"description": "Content-addressed ID of this federation manifest."
},
"canonicalization_profile": {
"type": "string",
"const": "kristal.v5:jcs-rfc8785",
"description": "Canonicalization profile identifier used to derive content_hash and federation_id."
},
"canonicalization_version": {
"type": "string",
"const": "1",
"description": "Canonicalization profile version."
},
"content_hash": {
"$ref": "#/$defs/hash",
"description": "Hash of the canonicalized federation hash target. federation_id, content_hash, signatures, manifest_id, and created_at are excluded."
},
"authority_registry_ref": {
"$ref": "#/$defs/authority_registry_ref",
"description": "Pinned authority registry used to interpret authority channels, recognition, validation policy, and reader policy."
},
"shards": {
"type": "array",
"minItems": 1,
"description": "Referenced shards. Federation preserves shard identity and does not rewrite shard contents.",
"items": {
"$ref": "#/$defs/shard_ref"
}
},
"composition_policy": {
"$ref": "#/$defs/composition_policy",
"description": "Deterministic composition rules for overlap, ordering, conflict visibility, and reader-policy selection."
},
"reader_policy_refs": {
"type": "array",
"description": "Reader policies available for this federation, such as reference_only, validated_only, research, creative, all_with_labels, or custom.",
"items": {
"$ref": "#/$defs/reader_policy_ref"
}
},
"authority_recognition_refs": {
"type": "array",
"description": "Recognition records that state which authority channels recognize this federation, its shards, or selected assertions.",
"items": {
"$ref": "#/$defs/authority_recognition_ref"
}
},
"validation_policy_refs": {
"type": "array",
"description": "Validation policies used or referenced by this federation.",
"items": {
"$ref": "#/$defs/validation_policy_ref"
}
},
"trust_requirements": {
"$ref": "#/$defs/trust_requirements",
"description": "Optional machine-readable requirements for consuming this federation under selected channels or scopes."
},
"publisher": {
"$ref": "#/$defs/publisher",
"description": "Publisher identity metadata for the federation manifest."
},
"signatures": {
"type": "array",
"minItems": 1,
"description": "Publisher or authority signatures over the federation manifest signing target.",
"items": {
"$ref": "#/$defs/signature"
}
},
"references": {
"type": "object",
"description": "Optional references to specs or docs for traceability.",
"additionalProperties": false,
"properties": {
"spec_version": {
"type": "string",
"const": "5.0"
},
"docs_uri": {
"type": "string",
"format": "uri"
}
}
},
"extensions": {
"type": "object",
"description": "Implementation-specific fields. Extensions must not change core identity, hashing, validation, recognition, or federation semantics.",
"additionalProperties": true
}
},
"$defs": {
"sha256_hex": {
"type": "string",
"pattern": "^[a-f0-9]{64}$"
},
"sha256_prefixed": {
"type": "string",
"pattern": "^sha256:[a-f0-9]{64}$"
},
"federation_id": {
"$ref": "#/$defs/sha256_prefixed"
},
"hash": {
"type": "object",
"additionalProperties": false,
"required": [
"alg",
"value"
],
"properties": {
"alg": {
"type": "string",
"enum": [
"sha256"
],
"description": "Hash algorithm identifier."
},
"value": {
"$ref": "#/$defs/sha256_hex",
"description": "Lowercase hex-encoded hash digest."
}
}
},
"signature": {
"type": "object",
"additionalProperties": false,
"required": [
"key_id",
"alg",
"payload_hash",
"signature"
],
"properties": {
"sig_id": {
"type": "string",
"minLength": 1,
"description": "Optional unique signature identifier."
},
"key_id": {
"type": "string",
"minLength": 1,
"description": "Key identifier used to verify this signature."
},
"alg": {
"type": "string",
"enum": [
"ed25519",
"rsa-pss-sha256",
"ecdsa-p256-sha256"
],
"description": "Signature algorithm identifier."
},
"payload_hash": {
"$ref": "#/$defs/hash",
"description": "Hash of the signing target bytes as defined by the signing target rules."
},
"signature": {
"type": "string",
"minLength": 1,
"description": "Signature value. Encoding is defined by the signature profile; base64url is recommended."
},
"created_at": {
"type": "string",
"format": "date-time"
},
"expires_at": {
"type": [
"string",
"null"
],
"format": "date-time"
},
"purpose": {
"type": "string",
"enum": [
"publisher",
"authority",
"auditor",
"distributor",
"transparency_log"
]
},
"signer": {
"type": "object",
"additionalProperties": false,
"properties": {
"name": {
"type": "string",
"minLength": 1
},
"org": {
"type": "string",
"minLength": 1
},
"authority_channel_id": {
"$ref": "#/$defs/authority_channel_id"
}
}
},
"certificate_uri": {
"type": "string",
"format": "uri",
"description": "Optional pointer to a certificate chain or public key material."
}
}
},
"authority_channel_id": {
"type": "string",
"pattern": "^authority:[a-z0-9][a-z0-9.*:-]*$"
},
"authority_registry_id": {
"type": "string",
"anyOf": [
{
"pattern": "^kristal:authority-registry:sha256:[a-f0-9]{64}$"
},
{
"pattern": "^sha256:[a-f0-9]{64}$"
},
{
"pattern": "^authority-registry:[a-z0-9][a-z0-9.*:-]*$"
}
]
},
"authority_registry_ref": {
"type": "object",
"additionalProperties": false,
"required": [
"registry_id",
"ref",
"content_hash"
],
"properties": {
"registry_id": {
"$ref": "#/$defs/authority_registry_id",
"description": "Identifier of the referenced authority registry."
},
"ref": {
"type": "string",
"minLength": 1,
"description": "Relative path or URI to the registry artifact within the distribution."
},
"content_hash": {
"$ref": "#/$defs/hash"
},
"signatures": {
"type": "array",
"description": "Optional signatures for the referenced registry artifact.",
"items": {
"$ref": "#/$defs/signature"
}
}
}
},
"scope": {
"type": "object",
"additionalProperties": false,
"required": [
"domain"
],
"properties": {
"domain": {
"type": "string",
"enum": [
"general",
"wikidata",
"science",
"health",
"education",
"heritage",
"law",
"policy",
"technology",
"environment",
"culture",
"mythology",
"fiction",
"research",
"operations",
"civic",
"local_notes"
]
},
"subdomain": {
"type": [
"string",
"null"
],
"minLength": 1
},
"jurisdiction": {
"type": [
"string",
"null"
],
"minLength": 1
},
"time_window": {
"type": [
"string",
"null"
],
"minLength": 1,
"description": "Implementation-defined time slice label, such as 2026-01."
},
"tenant_id": {
"type": [
"string",
"null"
],
"minLength": 1
},
"environment": {
"type": [
"string",
"null"
],
"minLength": 1
},
"language": {
"type": [
"string",
"null"
],
"minLength": 2
}
}
},
"artifact_ref": {
"type": "object",
"additionalProperties": false,
"required": [
"artifact_type",
"id",
"ref",
"content_hash"
],
"properties": {
"artifact_type": {
"type": "string",
"minLength": 1
},
"id": {
"type": "string",
"minLength": 1
},
"ref": {
"type": "string",
"minLength": 1,
"description": "Relative path or URI to the referenced artifact."
},
"content_hash": {
"$ref": "#/$defs/hash"
}
}
},
"reader_policy_ref": {
"allOf": [
{
"$ref": "#/$defs/artifact_ref"
},
{
"type": "object",
"properties": {
"artifact_type": {
"const": "reader_policy"
}
}
}
]
},
"authority_recognition_ref": {
"allOf": [
{
"$ref": "#/$defs/artifact_ref"
},
{
"type": "object",
"properties": {
"artifact_type": {
"const": "authority_recognition"
}
}
}
]
},
"validation_policy_ref": {
"allOf": [
{
"$ref": "#/$defs/artifact_ref"
},
{
"type": "object",
"properties": {
"artifact_type": {
"const": "validation_policy"
}
}
}
]
},
"validation_ref": {
"allOf": [
{
"$ref": "#/$defs/artifact_ref"
},
{
"type": "object",
"properties": {
"artifact_type": {
"enum": [
"validation_report",
"validation_decision"
]
}
}
}
]
},
"shard_ref": {
"type": "object",
"additionalProperties": false,
"required": [
"shard_id",
"scope",
"artifact_status",
"shard_manifest_ref",
"shard_manifest_hash"
],
"properties": {
"shard_id": {
"$ref": "#/$defs/sha256_prefixed",
"description": "Content-addressed ID of the shard Exchange."
},
"scope": {
"$ref": "#/$defs/scope"
},
"artifact_status": {
"type": "string",
"enum": [
"draft",
"working",
"under_review",
"recognized",
"reference",
"deprecated",
"superseded",
"revoked"
],
"description": "Status of the shard artifact within its declared authority channel and scope."
},
"shard_manifest_ref": {
"type": "string",
"minLength": 1,
"description": "Relative path or URI to the shard manifest artifact."
},
"shard_manifest_hash": {
"$ref": "#/$defs/hash",
"description": "Hash of the referenced shard manifest."
},
"authority_channel_refs": {
"type": "array",
"description": "Authority channels relevant to this shard.",
"items": {
"$ref": "#/$defs/authority_channel_id"
}
},
"authority_recognition_refs": {
"type": "array",
"description": "Recognition records scoped to this shard.",
"items": {
"$ref": "#/$defs/authority_recognition_ref"
}
},
"validation_refs": {
"type": "array",
"description": "Validation reports or decisions scoped to this shard.",
"items": {
"$ref": "#/$defs/validation_ref"
}
},
"seals": {
"type": "array",
"description": "Optional signatures copied from the shard manifest for self-contained verification.",
"items": {
"$ref": "#/$defs/signature"
}
},
"extensions": {
"type": "object",
"additionalProperties": true
}
}
},
"composition_policy": {
"type": "object",
"additionalProperties": false,
"required": [
"policy_id",
"policy_version",
"overlap_strategy",
"conflict_strategy",
"default_visibility",
"ordering"
],
"properties": {
"policy_id": {
"type": "string",
"minLength": 1,
"description": "Deterministic composition policy identifier."
},
"policy_version": {
"type": "string",
"minLength": 1,
"description": "Policy version identifier."
},
"overlap_strategy": {
"type": "string",
"enum": [
"authority_precedence",
"latest_time_window",
"explicit_allow_deny",
"preserve_all",
"reader_policy_selected"
],
"description": "How overlapping shards are selected or retained."
},
"conflict_strategy": {
"type": "string",
"enum": [
"preserve_disagreement",
"authority_precedence",
"mark_disputed",
"exclude_conflict",
"require_reader_choice"
],
"description": "How conflicting claims remain visible or are selected."
},
"default_visibility": {
"type": "string",
"enum": [
"reader_policy",
"reference_only",
"validated_only",
"all_with_labels",
"custom"
],
"description": "Default visibility mode before a reader policy is explicitly chosen."
},
"ordering": {
"type": "string",
"enum": [
"stable",
"authority_then_scope_then_hash",
"scope_then_time_then_hash",
"manifest_order"
],
"description": "Deterministic ordering rule for composed shards."
},
"authority_precedence": {
"type": "array",
"description": "Optional ordered authority channel IDs used when overlap_strategy or conflict_strategy is authority_precedence.",
"items": {
"$ref": "#/$defs/authority_channel_id"
}
},
"parameters": {
"type": "object",
"description": "Additional deterministic policy parameters for a given federation_id.",
"additionalProperties": true
}
}
},
"trust_requirements": {
"type": "array",
"description": "Optional consuming requirements by scope. These requirements constrain display or activation under selected reader and authority policies.",
"items": {
"type": "object",
"additionalProperties": false,
"required": [
"scope"
],
"properties": {
"scope": {
"type": "object",
"additionalProperties": false,
"properties": {
"domain": {
"type": "string",
"minLength": 1
},
"subdomain": {
"type": "string",
"minLength": 1
},
"shard_id": {
"$ref": "#/$defs/sha256_prefixed"
}
},
"anyOf": [
{
"required": [
"domain"
]
},
{
"required": [
"shard_id"
]
}
]
},
"required_authority_channels": {
"type": "array",
"items": {
"$ref": "#/$defs/authority_channel_id"
}
},
"allowed_validation_statuses": {
"type": "array",
"items": {
"type": "string",
"enum": [
"not_evaluated",
"in_review",
"validated",
"conditionally_validated",
"disputed",
"rejected",
"revoked"
]
}
},
"allowed_certainty_levels": {
"type": "array",
"items": {
"type": "string",
"enum": [
"unknown",
"speculative",
"low",
"medium",
"high",
"established",
"not_applicable"
]
}
},
"allowed_validated_as": {
"type": "array",
"items": {
"type": "string",
"enum": [
"hypothesis",
"claim",
"sourced_claim",
"reviewed_claim",
"high_confidence_fact",
"institutional_reference",
"publisher_declaration",
"technical_specification",
"legal_or_policy_position",
"mythological_corpus",
"fictional_corpus",
"symbolic_model",
"disputed_position",
"rejected_claim"
]
}
},
"include_disputed": {
"type": "boolean",
"default": false
},
"include_fictional": {
"type": "boolean",
"default": false
},
"include_mythological": {
"type": "boolean",
"default": false
}
}
}
},
"publisher": {
"type": "object",
"additionalProperties": false,
"required": [
"authority_channel_id",
"key_id"
],
"properties": {
"authority_channel_id": {
"$ref": "#/$defs/authority_channel_id",
"description": "Publisher authority channel identifier."
},
"key_id": {
"type": "string",
"minLength": 1,
"description": "Publisher key identifier."
},
"name": {
"type": "string",
"minLength": 1
}
}
}
}
}
