{
"schema_version": "5.0",
"artifact_type": "exchange_federation_manifest",
"manifest_id": "sha256:0f4a2c8e9b1d3f5a6c7e8d9f0a1b2c3d4e5f60718293a4b5c6d7e8f9a0b1c2de",
"created_at": "2026-03-01T12:00:00Z",
"federation_id": "sha256:0f4a2c8e9b1d3f5a6c7e8d9f0a1b2c3d4e5f60718293a4b5c6d7e8f9a0b1c2de",
"canonicalization_profile": "kristal.v5:jcs-rfc8785",
"canonicalization_version": "1",
"content_hash": {
"alg": "sha256",
"value": "0f4a2c8e9b1d3f5a6c7e8d9f0a1b2c3d4e5f60718293a4b5c6d7e8f9a0b1c2de"
},
"authority_registry_ref": {
"registry_id": "sha256:aaaaaaaaaaaaaaaaaaaaaaaaaaaaaaaaaaaaaaaaaaaaaaaaaaaaaaaaaaaaaaaa",
"ref": "authority/authority-registry.json",
"content_hash": {
"alg": "sha256",
"value": "aaaaaaaaaaaaaaaaaaaaaaaaaaaaaaaaaaaaaaaaaaaaaaaaaaaaaaaaaaaaaaaa"
},
"signatures": [
{
"sig_id": "sig:authority-registry-example-0001",
"key_id": "kristal-reference-ops-ed25519-2026-03",
"alg": "ed25519",
"payload_hash": {
"alg": "sha256",
"value": "aaaaaaaaaaaaaaaaaaaaaaaaaaaaaaaaaaaaaaaaaaaaaaaaaaaaaaaaaaaaaaaa"
},
"signature": "ZHVtbXktYXV0aG9yaXR5LXJlZ2lzdHJ5LXNpZ25hdHVyZQ",
"created_at": "2026-03-01T12:00:00Z",
"purpose": "authority"
}
]
},
"shards": [
{
"shard_id": "sha256:1111111111111111111111111111111111111111111111111111111111111111",
"scope": {
"domain": "education",
"subdomain": "science-reference",
"jurisdiction": null,
"time_window": null,
"tenant_id": "tenant_demo",
"environment": "dev",
"language": "en"
},
"artifact_status": "reference",
"shard_manifest_ref": "shards/science-earth-shape-reference/exchange-shard-manifest.json",
"shard_manifest_hash": {
"alg": "sha256",
"value": "1111111111111111111111111111111111111111111111111111111111111111"
},
"authority_channel_refs": [
"authority:unesco-science-education"
],
"authority_recognition_refs": [
{
"artifact_type": "authority_recognition",
"id": "sha256:1313131313131313131313131313131313131313131313131313131313131313",
"ref": "authority-recognitions/unesco-science-earth-shape-reference.json",
"content_hash": {
"alg": "sha256",
"value": "1313131313131313131313131313131313131313131313131313131313131313"
}
}
],
"validation_refs": [
{
"artifact_type": "validation_report",
"id": "sha256:1212121212121212121212121212121212121212121212121212121212121212",
"ref": "validation-reports/science-earth-shape-reference-validation.json",
"content_hash": {
"alg": "sha256",
"value": "1212121212121212121212121212121212121212121212121212121212121212"
}
}
],
"extensions": {
"validation_status": "validated",
"recognition_status": "recognized",
"certainty_level": "established",
"validated_as": "high_confidence_fact"
}
},
{
"shard_id": "sha256:2222222222222222222222222222222222222222222222222222222222222222",
"scope": {
"domain": "wikidata",
"subdomain": "seed-reference",
"jurisdiction": null,
"time_window": "2026-03-01",
"tenant_id": "tenant_demo",
"environment": "dev",
"language": "en"
},
"artifact_status": "reference",
"shard_manifest_ref": "shards/wikidata-seed-earth-shape/exchange-shard-manifest.json",
"shard_manifest_hash": {
"alg": "sha256",
"value": "2222222222222222222222222222222222222222222222222222222222222222"
},
"authority_channel_refs": [
"authority:wikidata-seed"
],
"authority_recognition_refs": [
{
"artifact_type": "authority_recognition",
"id": "sha256:2424242424242424242424242424242424242424242424242424242424242424",
"ref": "authority-recognitions/wikidata-seed-recognition.json",
"content_hash": {
"alg": "sha256",
"value": "2424242424242424242424242424242424242424242424242424242424242424"
}
}
],
"validation_refs": [
{
"artifact_type": "validation_report",
"id": "sha256:2323232323232323232323232323232323232323232323232323232323232323",
"ref": "validation-reports/wikidata-seed-packaging-validation.json",
"content_hash": {
"alg": "sha256",
"value": "2323232323232323232323232323232323232323232323232323232323232323"
}
}
],
"extensions": {
"validation_status": "validated",
"recognition_status": "recognized",
"certainty_profile": "mixed",
"validated_as": "institutional_reference"
}
},
{
"shard_id": "sha256:3333333333333333333333333333333333333333333333333333333333333333",
"scope": {
"domain": "research",
"subdomain": "earth-observation-notes",
"jurisdiction": null,
"time_window": "2025-01-01/2026-03-01",
"tenant_id": "tenant_demo",
"environment": "dev",
"language": "en"
},
"artifact_status": "under_review",
"shard_manifest_ref": "shards/independent-research-earth-observation-notes/exchange-shard-manifest.json",
"shard_manifest_hash": {
"alg": "sha256",
"value": "3333333333333333333333333333333333333333333333333333333333333333"
},
"authority_channel_refs": [
"authority:independent-research-collective"
],
"authority_recognition_refs": [],
"validation_refs": [],
"extensions": {
"validation_status": "in_review",
"recognition_status": "under_review",
"certainty_level": "medium",
"validated_as": "reviewed_claim"
}
},
{
"shard_id": "sha256:4444444444444444444444444444444444444444444444444444444444444444",
"scope": {
"domain": "local_notes",
"subdomain": "divergent-earth-shape-claims",
"jurisdiction": null,
"time_window": null,
"tenant_id": "tenant_demo",
"environment": "dev",
"language": "en"
},
"artifact_status": "working",
"shard_manifest_ref": "shards/local-community-divergent-earth-shape-claims/exchange-shard-manifest.json",
"shard_manifest_hash": {
"alg": "sha256",
"value": "4444444444444444444444444444444444444444444444444444444444444444"
},
"authority_channel_refs": [
"authority:local-community-archive"
],
"authority_recognition_refs": [
{
"artifact_type": "authority_recognition",
"id": "sha256:4646464646464646464646464646464646464646464646464646464646464646",
"ref": "authority-recognitions/local-community-divergent-position-recognition.json",
"content_hash": {
"alg": "sha256",
"value": "4646464646464646464646464646464646464646464646464646464646464646"
}
}
],
"validation_refs": [
{
"artifact_type": "validation_report",
"id": "sha256:4545454545454545454545454545454545454545454545454545454545454545",
"ref": "validation-reports/local-community-divergent-position-validation.json",
"content_hash": {
"alg": "sha256",
"value": "4545454545454545454545454545454545454545454545454545454545454545"
}
}
],
"extensions": {
"validation_status": "validated",
"recognition_status": "recognized",
"certainty_level": "low",
"validated_as": "disputed_position"
}
},
{
"shard_id": "sha256:5555555555555555555555555555555555555555555555555555555555555555",
"scope": {
"domain": "mythology",
"subdomain": "cosmology-symbolic-systems",
"jurisdiction": null,
"time_window": null,
"tenant_id": "tenant_demo",
"environment": "dev",
"language": "en"
},
"artifact_status": "reference",
"shard_manifest_ref": "shards/mythological-cosmology-corpus/exchange-shard-manifest.json",
"shard_manifest_hash": {
"alg": "sha256",
"value": "5555555555555555555555555555555555555555555555555555555555555555"
},
"authority_channel_refs": [
"authority:cultural-heritage-archive"
],
"authority_recognition_refs": [
{
"artifact_type": "authority_recognition",
"id": "sha256:5757575757575757575757575757575757575757575757575757575757575757",
"ref": "authority-recognitions/cultural-heritage-mythology-recognition.json",
"content_hash": {
"alg": "sha256",
"value": "5757575757575757575757575757575757575757575757575757575757575757"
}
}
],
"validation_refs": [
{
"artifact_type": "validation_report",
"id": "sha256:5656565656565656565656565656565656565656565656565656565656565656",
"ref": "validation-reports/mythological-cosmology-corpus-validation.json",
"content_hash": {
"alg": "sha256",
"value": "5656565656565656565656565656565656565656565656565656565656565656"
}
}
],
"extensions": {
"validation_status": "validated",
"recognition_status": "recognized",
"certainty_level": "not_applicable",
"validated_as": "mythological_corpus"
}
}
],
"composition_policy": {
"policy_id": "kristal.v5:composition-policy:preserve-disagreement-demo",
"policy_version": "1",
"overlap_strategy": "preserve_all",
"conflict_strategy": "preserve_disagreement",
"default_visibility": "reader_policy",
"ordering": "stable",
"authority_precedence": [
"authority:unesco-science-education",
"authority:wikidata-seed",
"authority:independent-research-collective",
"authority:local-community-archive",
"authority:cultural-heritage-archive"
],
"parameters": {
"conflict_labels_required": true,
"preserve_source_shard_ids": true,
"preserve_authority_channels": true
}
},
"reader_policy_refs": [
{
"artifact_type": "reader_policy",
"id": "reader_policy:reference-only-science-education",
"ref": "reader-policies/reference-only-science-education.json",
"content_hash": {
"alg": "sha256",
"value": "6161616161616161616161616161616161616161616161616161616161616161"
}
},
{
"artifact_type": "reader_policy",
"id": "reader_policy:validated-only-with-labels",
"ref": "reader-policies/validated-only-with-labels.json",
"content_hash": {
"alg": "sha256",
"value": "6262626262626262626262626262626262626262626262626262626262626262"
}
},
{
"artifact_type": "reader_policy",
"id": "reader_policy:research-all-with-labels",
"ref": "reader-policies/research-all-with-labels.json",
"content_hash": {
"alg": "sha256",
"value": "6363636363636363636363636363636363636363636363636363636363636363"
}
},
{
"artifact_type": "reader_policy",
"id": "reader_policy:creative-and-mythology",
"ref": "reader-policies/creative-and-mythology.json",
"content_hash": {
"alg": "sha256",
"value": "6464646464646464646464646464646464646464646464646464646464646464"
}
}
],
"authority_recognition_refs": [
{
"artifact_type": "authority_recognition",
"id": "sha256:8181818181818181818181818181818181818181818181818181818181818181",
"ref": "authority-recognitions/kristal-reference-ops-federation-recognition.json",
"content_hash": {
"alg": "sha256",
"value": "8181818181818181818181818181818181818181818181818181818181818181"
}
}
],
"validation_policy_refs": [
{
"artifact_type": "validation_policy",
"id": "kristal.v5:validation-policy:federation-schema-validation",
"ref": "validation-policies/federation-schema-validation.json",
"content_hash": {